{"classification":"SYNTHETIC","data_pack_id":"housing-data","decisions":[{"constraints":["No ejecutar cambios comerciales automáticamente.","No confundir simulación con evidencia causal."],"finding_id":"DEMO-A-finding","id":"DEMO-A-finding-decision","model_pack_id":"housing-model","objective":"Comprender el cambio de ritmo sin atribuir causas no identificadas.","options":["Mantener y medir","Revisar composición","Diseñar experimento de precio"],"outcome":{"status":"NOT_OBSERVED","value":null},"owner":null,"question":"¿Qué investigar antes de cambiar precios?","recommended_action":"Revisar composición y reunir evidencia antes de decidir pricing.","scenario_ids":["DEMO-A-slow","DEMO-A-base","DEMO-A-fast"],"status":"REVIEW_REQUIRED"},{"constraints":["No ejecutar cambios comerciales automáticamente.","No confundir simulación con evidencia causal."],"finding_id":"DEMO-B-finding","id":"DEMO-B-finding-decision","model_pack_id":"housing-model","objective":"Comprender el cambio de ritmo sin atribuir causas no identificadas.","options":["Mantener y medir","Revisar composición","Diseñar experimento de precio"],"outcome":{"status":"NOT_OBSERVED","value":null},"owner":null,"question":"¿Qué investigar antes de cambiar precios?","recommended_action":"Revisar composición y reunir evidencia antes de decidir pricing.","scenario_ids":["DEMO-B-slow","DEMO-B-base","DEMO-B-fast"],"status":"REVIEW_REQUIRED"}],"findings":[{"cannot_conclude":["Que precio sea la causa.","Que stock pequeño implique demanda fuerte."],"confidence":{"reason":"Comparación aritmética; no prueba significancia ni causalidad.","status":"NOT_ASSESSED"},"evidence_type":"descriptive","id":"DEMO-A-finding","indicator_ids":["DEMO-A-stock","DEMO-A-velocity"],"possible_explanations":["Composición del stock disponible","Estacionalidad","Cambios de demanda"],"statement":"DEMO-A: ritmo reciente 3.33 unidades/mes frente a 6.33 en el trimestre anterior; stock final 67."},{"cannot_conclude":["Que precio sea la causa.","Que stock pequeño implique demanda fuerte."],"confidence":{"reason":"Comparación aritmética; no prueba significancia ni causalidad.","status":"NOT_ASSESSED"},"evidence_type":"descriptive","id":"DEMO-B-finding","indicator_ids":["DEMO-B-stock","DEMO-B-velocity"],"possible_explanations":["Composición del stock disponible","Estacionalidad","Cambios de demanda"],"statement":"DEMO-B: ritmo reciente 7.67 unidades/mes frente a 6.33 en el trimestre anterior; stock final 64."}],"id":"housing-story","kind":"story","label":"DEMO / SYNTHETIC DATA","model_pack_id":"housing-model","next_test":"Congelar pronósticos antes del próximo mes y medir sus errores con el mismo universo.","provenance":{"as_of":"2026-10-01","dataset_sha256":"056f0d8331eeb8a3751c03063740f248a4942c7a21fc54e10b4b77fce27bf2ed","generated_at":"2026-10-09T18:00:00Z","limitations":["Datos inventados exclusivamente para demostración.","Sin reposiciones, anulaciones intermedias ni cambios de universo."],"semantics":"SYNTHETIC_DEMO","source":"Authored deterministic fixture housing-v1","transformation":"Meses completos; cohorte fija; media móvil de tres meses limitada por stock."},"question":"¿Tener menos stock significa que estamos vendiendo mejor?","schema_version":"1.0.0","steps":[{"body":"El stock es un saldo. El ritmo mide un flujo. Para entender la evolución necesitamos ambos.","indicator_ids":[],"title":"La pregunta"},{"body":"Compara el inventario final con las ventas mensuales y su ritmo reciente. Todos los períodos son meses completos.","indicator_ids":["DEMO-A-stock","DEMO-A-velocity","DEMO-A-sales","DEMO-B-stock","DEMO-B-velocity","DEMO-B-sales"],"title":"La evidencia"},{"body":"Promedia las ventas de los tres meses anteriores y aplica el límite del stock. Es un baseline auditable, no ML entrenado.","indicator_ids":[],"title":"El modelo"},{"body":"Cambia el supuesto de ritmo y compara con el escenario original. No estás midiendo un efecto causal.","indicator_ids":[],"title":"El experimento"}],"version":"1.0.0","what_we_do_not_know":"No conocemos el efecto causal del precio ni la demanda no observada.","what_we_learned":"Separar saldo, flujo y supuesto evita conclusiones apresuradas.","wisdom_cards":[{"application":"Comparar ritmo, composición y exposición antes de recomendar.","caution":"No inferir preferencia solo de ventas absolutas.","finding_id":"DEMO-A-finding","id":"stock-is-not-demand","observation":"Un saldo menor puede coexistir con un ritmo menor.","title":"Stock no es demanda","validation_status":"EDUCATIONAL_NOT_VALIDATED_POLICY","why":"La oferta disponible limita lo que puede venderse."}]}
